Serial No,ratings,vote,verified,reviewTime,reviewerID,asin,reviewerName,reviewText,summary,unixReviewTime,category,product type,brand,main_cat,price,Human Sentiment Score,Review Type,Sentiment_Score,Sentiment_Magnitude,Normalized_Sentiment_Scores
7955,5,,True,"06 26, 2018",A32ID15SK3PZ71,B01ALBMIEI,Jessica Beland,"I recently moved from a huge house with a large washer and gas dryer to a very small but very cute little apartment that was built in the 1800s. Since its just me, I thought this machine would be great.  I did a lot of research before purchasing.
This little machine has been a godsend.  I watched a LOT of videos on how to use it and Im glad I did because I was READY.

1. The instructions are hilariously awful.  At one point it says to spin the Revolution. I was like.. say what? Watch the videos. Its a pretty simple process.
2.  The intake hose is useless. It doesnt fit any faucet known to mankind. You will either have to buy an adaptor but my solution was to set it up next to my standing shower and use my shower head. When I first got it I used a bucket of water. Works fantastic.
3. You need to put this machine upright to drain it properly. There is no pump to drain the water out. It uses gravity.  I use two long wood boxes I have turned upside down and it works great.
4.  You will find that your clothes actually FEEL cleaner. For some reason maybe its the agitator is better, but my clothes smell and seem cleaner and fresher.
5.  Ok so LOTS of people run their clothes with a cycle with soap and then drain and then just put it in the spinner. Thats kinda gross, guys. To do a rinse cycle you just drain the tub and refill it and run a little 6 min cycle to drain the dirty wash water off of your clothes. Thats why rinse cycles exist.

Honestly you guys.. this thing is a 100 bucks DELIVERED to you.  It works. Its a simple design, which I actually prefer because its less electronic crap to go wrong. For not having to go to the laundromat or to my moms house for 4 hours while she inspects my clothes and comments on my underwear.. its great. I wish they had these when I was living in NY. Would have saved me MANY trips up my 4th floor walkup with a laundry bag and a granny cart.",Great Little Basic Machine,1529971200,"['Appliances', 'Laundry Appliances', 'Washers & Dryers', 'Specialty Laundry']",Specialty Laundry,Giantex,Appliances,12.8,0.7,Positive,0.0,18.1,0.0
7957,1,,True,"06 18, 2018",A2U9U438IOEYI8,B01ALBMIEI,Cesar,not fully described on the app....,"the drain hose is very short, the drain pump doesnt really pump water out unless the hose is totally horizontal ..",1529280000,"['Appliances', 'Laundry Appliances', 'Washers & Dryers', 'Specialty Laundry']",Specialty Laundry,Giantex,Appliances,12.8,0.5,Positive,-0.8,0.8,-0.76
7969,2,3,True,"04 26, 2018",A9F5U3CG7BU4G,B01ALBMIEI,keith obrien,Washer came used i wrote a big post but it didn't get cleared for some reason . Here are some pics,Washer came used i wrote a big post but it ...,1524700800,"['Appliances', 'Laundry Appliances', 'Washers & Dryers', 'Specialty Laundry']",Specialty Laundry,Giantex,Appliances,12.8,0.3,Positive,-0.4,0.9,-0.42
7971,5,2,True,"04 15, 2018",A3759JCNZD3K8Y,B01ALBMIEI,Jessica Ewellsen,"Tip! Keep the Styrofoam that comes in the box to help stabilize it.
I can't say enough good things about this washer! It fits so much more than you would think. Just looking at it, you would think it'd only fit a couple shirts, but I have fit queen size fitted sheet, sheet, 6 pillow cases, and a large, thick, quilted waterproof cover into the washing portion. I spin the waterproof cover by itself then fit everything else into the spin the second time. It is so simple to use and you can do laundry very quickly. The spinner makes the clothes basically dry. I have actually worn clothes that have come out of the spinner before.",Biggest size for your money!,1523750400,"['Appliances', 'Laundry Appliances', 'Washers & Dryers', 'Specialty Laundry']",Specialty Laundry,Giantex,Appliances,12.8,0.7,Positive,0.4,5.0,0.08
7981,5,,True,"03 1, 2018",A8TS653UPM6OV,B01ALBMIEI,Karen Phelps,"Love this little guy. The spinner is the best. it gets so much moisture out. I run my towels through the spinner twice just to be on the safe side, then let them air dry the rest of the way",Love this little guy,1519862400,"['Appliances', 'Laundry Appliances', 'Washers & Dryers', 'Specialty Laundry']",Specialty Laundry,Giantex,Appliances,12.8,0.8,Positive,0.5,2.8,0.18
7994,5,2,True,"01 11, 2018",A1NJHJPI9517DC,B01ALBMIEI,mu,"Wow! So happy I bought this! While it looks kind of like a toy (ala easy bake oven haha), it is anything but a toy! I cannot use public laundry facilities due to chemicals, detergents, and dryer sheets etc., so I got this to use in my living space/artist studio. I made an adapter (see videos on Amazon from users who show you how to do it) to hook it on to the water hose in my shower, and then I put it on chairs to drain the grey water into my bathtub using the gravity type of drain. I can't tell you how this has save me and my health issues! The load capacity is about half or less that of a normal washer, but that's okay for me. The motor is powerful and spins the cloths almost dry before I hang them on a clothes rack to dry. (My next purchase might be a small portable dryer to go with this washer). For the price ($100 when I bought it) you cannot go wrong! The only thing I cannot wash is large blankets or bedding or large heavy towels. I can wash bed sheets and regular bath towels just fine. It has a variable timer for wash and spin, but it is not based on actual time, it is numbered 1 through 15 (i.e.: it is not actually fifteen minutes, but I've never timed the cycle lengths). I HIGHLY recommend this little lightweight washer to use in dorm rooms, apartments or for anyone who suffers from multiple chemical sensitivities or similar illness and wants to be able to do laundry in a small space. It is so lightweight I can lift it up and down from chairs. (I while eventually get a rack on wheels that I can set it on and roll to and from the bathroom.) I suggest watching the customer review videos for more information.",LOVE This Mini Washer!,1515628800,"['Appliances', 'Laundry Appliances', 'Washers & Dryers', 'Specialty Laundry']",Specialty Laundry,Giantex,Appliances,12.8,0.8,Positive,0.5,9.9,0.05
7995,4,3,True,"12 30, 2017",A3418B8P1BNUCP,B01ALBMIEI,Justine Klein,"Im in love with this little machine. I live in an apartment building with one coin-op washer and dryer for everyone. This is the perfect solution to my public-laundry woes.
Pros:
-Its compact and fits into a small space in my small bathroom.
-The gravity drainage system means I can place the drain tube in my shower without moving the unit. Because there isna slight lift into the shower, the tube doesnt empty entirely, but it isn't enough of an issue to concern me.
-This only requires a standard electric outlet to operate. There is no extra wiring or plumbing needed to set it up and operate it.
-The wash capacity is pretty impressive for a portable machine. I can fit nearly as much into it as the apartment machine Ive used for the past
6 years. You can add items to the wash cycle after its started, so its easy to ensure you're not over-filling.
-It gets your laundry incredibly clean. I included a picture of the water draining after a wash cycle so you could see how much dirt it got out. Embarassing but helpful.
-The spin cycle gets the items so dry! Seriously,
Im surprised every time.
-I can do my laundry without ever leaving my apartment!! This alone makes it worth every penny!

Cons:
-The water hoses for filling the machine are woefully short, and are equipped to hook up to no faucet Ive ever seen.  I may one day purchase longer hoses to allow me to fill the wash tub from my bathroom sink, but in the meantime Ive been using a bucket I fill from the bathtub.
-Its a little labor intensive. Manually fill the wash tub, run a second cycle to rinse, split the wash into two parts to spin, hang everythig to dry. This isn't the kind of washing machine where you can push a button and let it do its thing. It needs babysat, but for me, the work is worth it for the convenience.
-The spin compartment is so much smaller than the wash compartment. I imagine it has to do with  the motor placement, but its taken 3 spin cycles sometimes to finish off the load.
-Its a little noisy. I live on the top floor and am always worried about causing too much noise for the downstairs neighbors. Im going to purchase a mat for this to sit on to absorb the noise, and to keep it from walking across the tile as it agitates and spins.

Ive told so many people about this machine. It isn't perfect, but when you live in an apartment in a big city, you take the conveniences you can get, and this is a HUGE convenience. I highly recommend it!",Wonderful for apartment living!!,1514592000,"['Appliances', 'Laundry Appliances', 'Washers & Dryers', 'Specialty Laundry']",Specialty Laundry,Giantex,Appliances,12.8,0.6,Positive,0.3,20.5,0.01
7999,5,,True,"12 6, 2017",A200H81ZDAOCJV,B01ALBMIEI,Cheryl H,"Super fast shipping. Weight on it is fantastic. Good job guys. The instruction book is a bit primitive, and with good eyes you need a magnifying glass to read what it says. Product itself is great.",Super fast shipping,1512518400,"['Appliances', 'Laundry Appliances', 'Washers & Dryers', 'Specialty Laundry']",Specialty Laundry,Giantex,Appliances,12.8,0.7,Positive,0.6,3.5,0.17
8001,5,,True,"11 30, 2017",A2WVFUCIQV79WN,B01ALBMIEI,Mike,"How have I not reviewed this yet?  Love it tons.  I've had it for about 3 months now and wash about once to twice a week.
I use it as my dirty clothes hamper, so I just wash when it approaches full.  If I'm not washing pants, I can usually wash 15+ articles of clothing between t-shirts, shorts, and underwear.  And plenty socks.  It'll take 15 minutes of washing, though I usually do 15 more minutes.  Then I spray lots of water in the washing compartment to rinse them out.  Afterwards, most batches take 2 sets of drying to dry.  Get it dry enough that I can put the clothes on a hanger and blow a fan at them and they be dry in a few hours.  When cold in the house, does take until morning.  (assuming I put it on the wash at 9PM and hang them at 10PM and not check on them until I wake up at 6:30 AM).

Love it though.  I've always been terrible about washing clothes, especially when I had to go to a laundromat.  Now I just cart the washer into the shower, fill with hot water, throw detergent in and turn it on.  It's great for lazy people like me as the cycles are so short.  If you forget to take something out, the second cycle still has enough time since it doesn't take long to do its thing.",Love it tons,1512000000,"['Appliances', 'Laundry Appliances', 'Washers & Dryers', 'Specialty Laundry']",Specialty Laundry,Giantex,Appliances,12.8,0.8,Positive,0.3,7.2,0.04
8004,5,,True,"11 24, 2017",A3V8BIYUFMAZYB,B01ALBMIEI,Yuanzhu,Greaaaaaaaaat!  Helps me a lot!,Five Stars,1511481600,"['Appliances', 'Laundry Appliances', 'Washers & Dryers', 'Specialty Laundry']",Specialty Laundry,Giantex,Appliances,12.8,0.8,Positive,0.7,1.5,0.44
8006,5,,True,"11 17, 2017",A35EEBJ8W0B3RG,B01ALBMIEI,Victor,This thing is the best thing ever I own 3 and I'm going to buy one more,I recommend it,1510876800,"['Appliances', 'Laundry Appliances', 'Washers & Dryers', 'Specialty Laundry']",Specialty Laundry,Giantex,Appliances,12.8,0.9,Positive,0.9,0.9,0.76
8013,5,,True,"10 24, 2017",A3PT2L246TR1LA,B01ALBMIEI,Michael Rehl,awesome works incredibly well at getting clothes clean and better than I expected,Five Stars,1508803200,"['Appliances', 'Laundry Appliances', 'Washers & Dryers', 'Specialty Laundry']",Specialty Laundry,Giantex,Appliances,12.8,0.7,Positive,0.9,0.9,0.76
8016,5,3,True,"10 2, 2017",A2GAWFNECEJCHY,B01ALBMIEI,Lauren S.,"This machine is the manual transmission of washing machines. Even so, it will change your life. How amazing to do laundry at home after going to the laundromat for years!!

As other reviewers have noted, the hose system has some major flaws. (The hose is actually completely useless.) I was too impatient to go the hardware store for a DIY hose-repair project, and filling the tub with a bucket works just fine.

If you're going to go with the bucket method, I would recommend dumping a full bucket of water on the clothes in the spin tub and then immediately turning on the spinner to rinse. Do that a couple times until the water coming out the bottom is no longer soapy. Rinsing in the wash tub seemed to take too many drain-and-refill cycles. Also, use about a quarter as much soap as you think you'll need. Getting the soap off was the trickiest part of the whole operation.

Some of the questions about the washer express concerns about the lack of a drain pump - I had absolutely no problem. Set the washer in the bathtub and the water drains right out. You don't need a pump.

The capacity is surprisingly large. I found that I could fit about half a regular size load in the wash tub, and about 1/3 of that in the spin tub. The spinner only takes 3-4 minutes, so it's not a terrible inconvenience to split the load up to ""dry."" Next day edit: I actually washed a queen size comforter in the wash tub. Had to take it downstairs to the community dryer to dry, but washing worked wonderfully.

Final note - you'll need a large clothes drying rack. The clothes come out damp-dry, but they still need a few hours on the drying rack. I originally bought the AmazonBasics Foldable Drying Rack - White, and after one day of laundry I've decided to purchase a more industrial size rack.",Neat little washer.,1506902400,"['Appliances', 'Laundry Appliances', 'Washers & Dryers', 'Specialty Laundry']",Specialty Laundry,Giantex,Appliances,12.8,0.8,Positive,0.0,9.8,0.0
8017,2,,True,"09 27, 2017",A3R8Z1C4TI8SHD,B01ALBMIEI,shahrokh sharifi,Not fit in a apartment.,Two Stars,1506470400,"['Appliances', 'Laundry Appliances', 'Washers & Dryers', 'Specialty Laundry']",Specialty Laundry,Giantex,Appliances,12.8,-0.6,Negative,-0.8,0.8,-0.76
8018,5,,True,"09 21, 2017",A1TE864D2N9779,B01ALBMIEI,Amazon Customer,it works great. I love it. the hose is too short but other than that it helps out a lot.,it works great. I love it,1505952000,"['Appliances', 'Laundry Appliances', 'Washers & Dryers', 'Specialty Laundry']",Specialty Laundry,Giantex,Appliances,12.8,0.6,Positive,0.5,1.9,0.26
8025,5,,True,"08 26, 2017",A16I8O4PUNUXYV,B01ALBMIEI,Patricia,"This is a Great product......I can wash 1 jean, 1 short, about 5 or 6 shirts, 3 underwear, 1 bra and some socks in one load.....although I do break that up into 2 loads when I spin it.....the spinner does such a great job that everything but the jeans dry within minutes........I would recommend this product .......although I would suggest buying a extended hose, the one attached is fine......but I want to be able to water my plants and grass by recycling the water......",Great product and mailed quickly,1503705600,"['Appliances', 'Laundry Appliances', 'Washers & Dryers', 'Specialty Laundry']",Specialty Laundry,Giantex,Appliances,12.8,0.6,Positive,0.3,0.3,0.76
8032,5,,True,"08 5, 2017",A38VJ0QHM7NR14,B01ALBMIEI,Amazon Customer,"Love it, absolutely no complaints. It does exactly what it's supposed to do and efficiently. Something that was pointed out to me by my mom and not here is that the spin dryer drains ALOT as well, leaving your clothes next to dry. Maybe it's obvious but it wasn't for me lol! I thought the washer would wring the clothes. The spin dryer can also be filled to the top! Don't be discouraged at how small it looks :)",So happy,1501891200,"['Appliances', 'Laundry Appliances', 'Washers & Dryers', 'Specialty Laundry']",Specialty Laundry,Giantex,Appliances,12.8,0.7,Positive,0.2,5.1,0.04
8034,5,,True,"07 29, 2017",A2762LUKOMLH3,B01ALBMIEI,Amazon Customer,"Excellent very good beautiful light weight very happy with purchase. Try to compete with panda little big pigger machine 19 lbs, bigger spinner, power full motor. But Giantex in class excellent.","Excellent,  light weight , smooth.",1501286400,"['Appliances', 'Laundry Appliances', 'Washers & Dryers', 'Specialty Laundry']",Specialty Laundry,Giantex,Appliances,12.8,0.8,Positive,0.5,1.7,0.29
8036,5,2,True,"07 24, 2017",A3OD3VW710QWST,B01ALBMIEI,mary riggleman,"I love the spin cycle, portability, & ease of use. Since I live in a trailer without a basement, I use it in the bathtub for draining but can store it elsewhere.
The water intake hose is flimsy. I prefer to fill the machine with a hose attachment from the shower head.
Overall, great for what I need at a great price --much better than the laundromat!",much better than the laundromat,1500854400,"['Appliances', 'Laundry Appliances', 'Washers & Dryers', 'Specialty Laundry']",Specialty Laundry,Giantex,Appliances,12.8,0.8,Positive,0.2,3.4,0.06
8042,3,,True,"06 29, 2017",A3EUMSJP6S0PXT,B01ALBMIEI,Mercy Knight,"leaves lint everywhere, even after cleaning lint trap",Three Stars,1498694400,"['Appliances', 'Laundry Appliances', 'Washers & Dryers', 'Specialty Laundry']",Specialty Laundry,Giantex,Appliances,12.8,-0.7,Negative,-0.8,0.8,-0.76
8044,5,,True,"06 22, 2017",A3ODAUZCV30YK6,B01ALBMIEI,Connie Berryman,Thanks you love my NEW washing machine. And everything that came with it. Thanks again.,Five Stars,1498089600,"['Appliances', 'Laundry Appliances', 'Washers & Dryers', 'Specialty Laundry']",Specialty Laundry,Giantex,Appliances,12.8,0.9,Positive,0.5,1.8,0.27
8045,5,,True,"06 17, 2017",A1KB1L0OXGHA8J,B01ALBMIEI,Candy,"Product arrived on time. Package was a little damaged but the washer wasn't. Unfortunately the instructions it comes with are vague and it seems like it was not translated appropriately but I looked at one of the reviews posted on here and her review was of great help. I have done 20 loads so far with no issues. I just recommend that if you do purchase this, keep in mind that it is small and made of plastic so don't over load and don't wash thick items such as comforters or big coats. Will update down the road but so far I am happy with this purchase.

Update 1/10/18
The washer is still running just like when I initially purchased it. I am very happy.",Great product,1497657600,"['Appliances', 'Laundry Appliances', 'Washers & Dryers', 'Specialty Laundry']",Specialty Laundry,Giantex,Appliances,12.8,0.2,Neutral,0.2,4.1,0.05
8049,5,3,True,"05 24, 2017",A31AOPGDN0Y8EU,B01ALBMIEI,She who knocks,"If you are in a small space, this thing is magical. The washing aspect rocks. The spin cycle gets a lot of the water out. You will need either a clothesline or a small dryer to get completely dry.

I've been using this all year and no complaints. It's a champ!",Great little washer/spinner,1495584000,"['Appliances', 'Laundry Appliances', 'Washers & Dryers', 'Specialty Laundry']",Specialty Laundry,Giantex,Appliances,12.8,0.7,Positive,0.5,4.3,0.12
8062,1,2,True,"04 7, 2018",A3TK6HIQ08LA8G,B01AYKYDI0,Loretta A.,"DO NOT BUY! I purchased this in August 2017 and by April 2018 it no longer worked. The ""ice filled"" light came on and will to go off and it will no longer make ice. And It was used only until October, when I put it away as I no longer needed lots of ice in the winter months. Took it out the first of April. It worked for 3 days and now the light will not go out and it will not make ice!  Customer service is non-existent. If I could give it 0 stars, I would!",Terrible customer service! Worse product!,1523059200,"['Appliances', 'Refrigerators, Freezers & Ice Makers', 'Ice Makers']",Ice Makers,DELLA,Appliances,18.29,-0.9,Negative,-0.6,5.6,-0.11
8075,4,,True,"09 16, 2017",A2BMNX2GZXG8QH,B01AYKYDI0,Amazon Customer,Works great - looks nice and makes lots of ice quickly.  Bought this as a alternate to replacing the one in my fridge that broke - AGAIN.  It is pretty loud and big on my counter are really my only complaints.,Great!,1505520000,"['Appliances', 'Refrigerators, Freezers & Ice Makers', 'Ice Makers']",Ice Makers,DELLA,Appliances,18.29,0.4,Positive,0.3,1.3,0.23
8076,4,,True,"09 14, 2017",A2RTGIBPSHGVK1,B01AYKYDI0,Amazon Customer,Had for over 6m and still working great! Doesn't produce a ton of ice at once but works great!,Four Stars,1505347200,"['Appliances', 'Refrigerators, Freezers & Ice Makers', 'Ice Makers']",Ice Makers,DELLA,Appliances,18.29,0.4,Positive,0.9,1.8,0.46
8080,1,5,True,"09 7, 2017",A8MGW4WOU0J0D,B01AYKYDI0,Kenny cobb,"It is A Piece shit. Only used less than 20 times then it is broke. Just save your money! If there is 0 star, I will rate below that. This is the worst products I bought online.",Five Stars,1504742400,"['Appliances', 'Refrigerators, Freezers & Ice Makers', 'Ice Makers']",Ice Makers,DELLA,Appliances,18.29,-0.9,Negative,-0.7,3.7,-0.19
8081,1,3,True,"08 19, 2017",A1EP6JW0MZTVTB,B01AYKYDI0,Amazon Customer,I wouldn't buy this ice maker again . It never really worked right . Sometimes it would say that it needed water but the water level was at the appropriate level. Sometimes it will give me an indication that the ice was full and there was no ice in the basket it was unpredictable and when it would make ice . Don't waste your money,Don't waste your money,1503100800,"['Appliances', 'Refrigerators, Freezers & Ice Makers', 'Ice Makers']",Ice Makers,DELLA,Appliances,18.29,-0.9,Negative,-0.5,3.3,-0.15
8083,1,3,True,"07 18, 2017",A2A9872YB6BEFT,B01AYKYDI0,Megan S.,"I gave this ice maker to my father as a gift.  When he opened it and turned it on to try prior to summer vacation use, it did not work.  Parts of the machine worked, but the condenser would not come on and it would not feed water to the machine.  It was never opened or used and did not work out of the box but because he waited to open it for a few months, the seller will not accept a return on this item.  I definitely would not buy again and not from this seller either!",Did not work out of the box,1500336000,"['Appliances', 'Refrigerators, Freezers & Ice Makers', 'Ice Makers']",Ice Makers,DELLA,Appliances,18.29,-0.7,Negative,-0.5,3.5,-0.14
8089,4,,True,"05 2, 2017",AMBLOWZGW1D3L,B01AYKYDI0,keithlevine,Love this thing! Use this at my cabin on weekends. Ice in 6 minutes!  Noisier than I had hoped but overall very pleased.,Love this thing,1493683200,"['Appliances', 'Refrigerators, Freezers & Ice Makers', 'Ice Makers']",Ice Makers,DELLA,Appliances,18.29,0.6,Positive,0.7,3.1,0.22
8096,1,7,True,"02 2, 2017",ATDQ0CNEYX0H9,B01AYKYDI0,susanne Brockwell,"If I could give this product 0 stars, I would. It just quit ! I called the cust. ser. # and was told there was only. 90 day warranty. Tough luck! A disposable item with no customer service ! Wow! No one cares.",90 day warranty. Buyer beware! It will quit after 91 days,1485993600,"['Appliances', 'Refrigerators, Freezers & Ice Makers', 'Ice Makers']",Ice Makers,DELLA,Appliances,18.29,-0.8,Negative,-0.2,5.9,-0.03
8097,5,,True,"12 31, 2016",A2PPAK0MBJMSKN,B01AYKYDI0,Amazon Customer,"Works as described, very pleased. Thank you",very pleased. Thank,1483142400,"['Appliances', 'Refrigerators, Freezers & Ice Makers', 'Ice Makers']",Ice Makers,DELLA,Appliances,18.29,0.8,Positive,0.9,1.8,0.46
8098,2,2,True,"12 27, 2016",ALYNS46GKG42Y,B01AYKYDI0,EErock,This one started off wrong. It took a few daYS FOR IT TO START making ice . Unplugged once  has now been unusable since..Its barely 4 months okd and te company that I purchased it from wants nothing to do with it. I have read tat a lot of brands of these type icemakers  stop working completely or stop working correctly after they have been unplugged I have tried all tat i know like resetting and bla blah it still won't work again . Its gonna be a garbage can now.,I have read tat a lot of brands of these type icemakers stop working completely or stop working correctly after they have been u,1482796800,"['Appliances', 'Refrigerators, Freezers & Ice Makers', 'Ice Makers']",Ice Makers,DELLA,Appliances,18.29,-0.7,Negative,-0.7,3.7,-0.19
8100,4,,True,"12 17, 2016",A21ILHM682H60A,B01AYKYDI0,Diane Green,"Great little machine so far. I love the red how fast it makes ice cubes.  The only concern is that the ice has a stale water or metallic smell. I've washed it out with soapy water but the smell remains. Other than that, I can see it will be a great addition to our RV and will free up room in the freezer.",Great For the RV,1481932800,"['Appliances', 'Refrigerators, Freezers & Ice Makers', 'Ice Makers']",Ice Makers,DELLA,Appliances,18.29,0.4,Positive,0.4,3.0,0.13
8121,3,,True,"07 28, 2018",A1XNLU2T0T4RY2,B01AYKYC5O,Dr,"Cant shift to smaller size, take long time to make ice",Work but take time,1532736000,"['Appliances', 'Refrigerators, Freezers & Ice Makers', 'Ice Makers']",Ice Makers,DELLA,Amazon Home,6.46,-0.7,Negative,-0.6,0.6,-0.76
8137,5,,True,"07 20, 2017",A2QK6YB8643Q2R,B01AYKYC5O,johnny breeden,lots of ice,Five Stars,1500508800,"['Appliances', 'Refrigerators, Freezers & Ice Makers', 'Ice Makers']",Ice Makers,DELLA,Amazon Home,6.46,0.4,Positive,0.5,0.5,0.76
8145,5,,True,"05 23, 2017",A27KZNNJRP4TZ5,B01AYKYC5O,lisa m,Wonderful camping asset!,Five Stars,1495497600,"['Appliances', 'Refrigerators, Freezers & Ice Makers', 'Ice Makers']",Ice Makers,DELLA,Amazon Home,6.46,0.7,Positive,0.9,0.9,0.76
8147,4,6,True,"04 30, 2017",A3ISI37I1ABTMD,B01AYKYC5O,Joe,"I was not able to use this ice maker for a couple of weeks due to the terrible taste the ice cubes made my water, possibly due to the plastic. Finally someone suggested that I turn the machine off and place an open box of baking soda in the ice cube basket! Wha-la! 24 hrs. later I no longer had the nasty taste in my cubes! Please add this to your trouble shooting list!",Nasty taste,1493510400,"['Appliances', 'Refrigerators, Freezers & Ice Makers', 'Ice Makers']",Ice Makers,DELLA,Amazon Home,6.46,-0.1,Neutral,0.2,3.2,0.06
