Serial No,ratings,vote,verified,reviewTime,reviewerID,asin,reviewerName,reviewText,summary,unixReviewTime,category,product type,brand,main_cat,price,Human Sentiment Score,Review Type,Sentiment_Score,Sentiment_Magnitude,Normalized_Sentiment_Scores
2637,5,,True,"08 17, 2015",AGIXCXLR1P5M0,B002YTXMT6,Julio Macias,Great it is exactly the product that need and the delivery time was excellent,Five Stars,1439769600,"['Appliances', 'Parts & Accessories', 'Refrigerator Parts & Accessories', 'Motors']",Refrigerator Motors,Samsung,Tools & Home Improvement,19.62,0.6,Positive,0.9,0.9,0.76
2638,5,,True,"01 5, 2015",ANE1KC5EHQIBN,B002ZD6OAA,consumer,fits perfect & good price.,Five Stars,1420416000,"['Appliances', 'Parts & Accessories', 'Range Hood Parts & Accessories', 'Filters']",Range Filters,Broan,Tools & Home Improvement,12.5,0.8,Positive,0.9,0.9,0.76
2643,5,,True,"01 3, 2014",A3V79SK66MHEIK,B0031XI5LY,Evelyn Jacobs,Just what I needed for my RV.  I was able to add much needed storage space for my refrigerator and at a great price.,Perfect Fit,1388707200,"['Appliances', 'Parts & Accessories', 'Refrigerator Parts & Accessories', 'Shelves']",Refrigerator Shelves,Norcold Inc. Refrigerators,Tools & Home Improvement,15.49,0.8,Positive,0.9,1.8,0.46
2644,3,,True,"02 6, 2017",A2TCVBT63ORWVM,B0034IVA04,Allen Bergstrom,"Great knob, just not for my stove. This does not fit the D shaped shaft with the spring clip inside. Not worth the trouble to return it.",Verify model of stove,1486339200,"['Appliances', 'Parts & Accessories', 'Range Parts & Accessories', 'Knobs']",Range Knobs,Whirlpool,Tools & Home Improvement,17.99,-0.3,Negative,-0.5,1.7,-0.29
2645,5,,True,"01 17, 2017",A3LYLWQRAR5QIY,B0034IVA04,Janice Detlefson,Just like the original,Five Stars,1484611200,"['Appliances', 'Parts & Accessories', 'Range Parts & Accessories', 'Knobs']",Range Knobs,Whirlpool,Tools & Home Improvement,17.99,0.7,Positive,0.9,0.9,0.76
2655,5,,True,"07 11, 2017",A343FN8QXZZ8I7,B0036BX2YG,Greg M.,"Nice Kit for sure, now I need a fancy Tap handle!!!!",It's all good Man.,1499731200,"['Appliances', 'Refrigerators, Freezers & Ice Makers', 'Kegerators']",Kegerators,Kegco,Amazon Home,190.97,0.6,Positive,0.8,0.8,0.76
2660,5,,True,"12 21, 2016",A1WSJLBSHOBDFC,B0036BX2YG,Fred,"Amazing! I bought 2 of these for a ""Beer Bar"" at our wedding, I made a bar to fit 4 kegs and these things worked beautifully. I'm sure would work just as well in a fridge conversion with 2 kegs.","Amazing! I bought 2 of these for a ""Beer ...",1482278400,"['Appliances', 'Refrigerators, Freezers & Ice Makers', 'Kegerators']",Kegerators,Kegco,Amazon Home,190.97,0.7,Positive,0.6,2.1,0.28
2662,4,,True,"08 3, 2016",A1DM7671XOKYDU,B0036BX2YG,D.K.,Does what it's supposed to. The regulator feels cheap and the plastic covers over the gauges fall of if you touch them wrong but it seems to be working. The tank looks great. Everything else seems solid.,The tank looks great. Everything else seems solid,1470182400,"['Appliances', 'Refrigerators, Freezers & Ice Makers', 'Kegerators']",Kegerators,Kegco,Amazon Home,190.97,0.6,Positive,0.4,3.1,0.13
2665,4,,True,"03 14, 2016",A1IDGSRDOGXBEM,B0036BX2YG,Jay C.,"Great product. I would suggest you get some tap covers so the taps don't get sticky, from day to day.",Good buy.,1457913600,"['Appliances', 'Refrigerators, Freezers & Ice Makers', 'Kegerators']",Kegerators,Kegco,Amazon Home,190.97,0.7,Positive,0.4,0.9,0.42
2668,5,,True,"05 3, 2017",A2AKWWR1PZ7UQT,B0036BYSR6,T. Figueroa,Great product. The components are sturdy and well built. We've run many gallons of beer through these taps and we're very happy with them.,Excellent Product,1493769600,"['Appliances', 'Refrigerators, Freezers & Ice Makers', 'Kegerators']",Kegerators,Kegco,Amazon Home,202,0.8,Positive,0.9,2.9,0.3
2669,5,,True,"03 6, 2017",AP2A6NNBSWAQX,B0036BYSR6,KC,Bought this for my husband for a Christmas gift.  we did have to go to Home depot and purchase a different mini  fridge.  our original mini fridge wouldn't work with his mini kegs they had a taller one that worked better.  Hook up was easy I recommend purchasing the drip tray to go with it.,for the beer lover!,1488758400,"['Appliances', 'Refrigerators, Freezers & Ice Makers', 'Kegerators']",Kegerators,Kegco,Amazon Home,202,0.8,Positive,0.2,1.6,0.12
2682,5,6,True,"10 30, 2013",A2KNM6I3RLRQ3N,B0036BYSR6,Ringo127,"I had an older single tap Summit SBC-500 kegerator given to me and the tap was leaky and the finish was pitted.  This was a nice upgrade and fit perfectly. Now I can have two tall 5 gallon kegs and serve both hard cider and beer. I love the press-on line clamps.

When I got the package there was a part missing, but a quick call to support and they had a replacement sent to me right away.",Nice upgrade for my old single tap.,1383091200,"['Appliances', 'Refrigerators, Freezers & Ice Makers', 'Kegerators']",Kegerators,Kegco,Amazon Home,202,0.8,Positive,0.5,4.3,0.12
2688,5,,True,"09 23, 2014",A3J8YSCUR44N9X,B0036BX2YG,Stephen Toscano,"works great, great price, easy to install.",Five Stars,1411430400,"['Appliances', 'Refrigerators, Freezers & Ice Makers', 'Kegerators']",Kegerators,Kegco,Amazon Home,190.97,0.8,Positive,0.9,0.9,0.76
2695,5,,True,"02 27, 2013",A2DUSVSUTP9QYL,B0036BX2YG,David Salazar,"Thank you very much for your attention, are excellent in sales by selling good quality products and original at 100 am",congratulations,1361923200,"['Appliances', 'Refrigerators, Freezers & Ice Makers', 'Kegerators']",Kegerators,Kegco,Amazon Home,190.97,0.5,Positive,0.9,0.9,0.76
2702,4,,True,"04 27, 2017",A1O37YGJ63R3PX,B003B4M0XW,Amazon Customer,They do the job they were indented to do.,Replacement Filters,1493251200,"['Appliances', 'Parts & Accessories', 'Humidifier Parts & Accessories', 'Replacement Wicks']",Replacement Wicks,BestAir,Amazon Home,10.66,0.7,Positive,0.7,0.7,0.76
2705,1,,True,"02 8, 2016",A3P8C4CBNLFPFE,B003B4M0XW,Amazon Customer,Tried to save a few bucks.  Not worth it. Humidity went down.,One Star,1454889600,"['Appliances', 'Parts & Accessories', 'Humidifier Parts & Accessories', 'Replacement Wicks']",Replacement Wicks,BestAir,Amazon Home,10.66,-0.5,Negative,-0.5,1.6,-0.3
2707,5,,True,"11 23, 2015",A5QKF2BU8RFUK,B003B4M0XW,RKH,Ordered the BestAir wick to replace the original wick. The BestAir fit perfect. Ready for winter...,Perfect fit,1448236800,"['Appliances', 'Parts & Accessories', 'Humidifier Parts & Accessories', 'Replacement Wicks']",Replacement Wicks,BestAir,Amazon Home,10.66,0.8,Positive,0.5,1.8,0.27
2714,5,,True,"07 15, 2013",AHOS92SYS3NGB,B003B4M0XW,Alice Cannon,Fine --no problems--best price. 16 additional word requirement makes no sense--I have nothing more to say. What a waste of words.,This is the filter I ordered!,1373846400,"['Appliances', 'Parts & Accessories', 'Humidifier Parts & Accessories', 'Replacement Wicks']",Replacement Wicks,BestAir,Amazon Home,10.66,0.8,Positive,-0.2,2.4,-0.08
2720,5,,True,"06 2, 2016",A1TSDH4HSYZYH1,B003B6KL0O,Amazon Customer,"Good quality hose, just what I needed to install my dishwasher.",nice hose,1464825600,"['Appliances', 'Parts & Accessories', 'Dishwasher Parts & Accessories', 'Hoses']",Dishwasher Hoses,LASCO,Tools & Home Improvement,10.99,0.8,Positive,0.9,0.9,0.76
2733,5,2,True,"08 7, 2016",A2BYZYIIVUOG5,B003BIGDKO,DaveT,"Turned a potential fridge replacement scare into a $35 job, that being said most units you'll need to know how to cut and splice wire. This motor and wiring harness assume you don't have an internal freezer light, assuming you do you'll have to splice the wire into the original wiring harness.","Excellent fix, advise knowing how to splice wiring before you attempt to replace this part.",1470528000,"['Appliances', 'Parts & Accessories', 'Refrigerator Parts & Accessories', 'Motors']",Refrigerator Motors,GE,Tools & Home Improvement,51.38,0.6,Positive,-0.3,0.7,-0.4
2737,5,,True,"06 11, 2015",A1V0BU3D8117RD,B003BIGDKO,Aaron Asbury,cold water again,Five Stars,1433980800,"['Appliances', 'Parts & Accessories', 'Refrigerator Parts & Accessories', 'Motors']",Refrigerator Motors,GE,Tools & Home Improvement,51.38,0.5,Positive,0.0,0.0,
2738,2,,True,"03 31, 2015",A3BFNVLK9NCDGD,B003BIGDKO,Amazon Customer,"The fan motor works. its easy to hook up. (required me to cut the wire and splice in the new motor.  The problem is that I was having an issue with the old motor making too much noise.  the new motor is actually louder than the old busted one.  this is the factory part though, so not sure what the issue is there.  I also replaced the main control board at the same time.",its easy to hook up,1427760000,"['Appliances', 'Parts & Accessories', 'Refrigerator Parts & Accessories', 'Motors']",Refrigerator Motors,GE,Tools & Home Improvement,51.38,-0.7,Negative,0.0,3.3,0.0
2739,5,,True,"11 12, 2014",A3ENIU3WLLG5JH,B003BIGDKO,washingtonbc,"Exact replacement.  It took about an hour to replace from start to finish.  That included empting the freezer, installing, and clean up.  Go to youtube for some videos on how to do it.",Exact replacement. It took about an hour to replace ...,1415750400,"['Appliances', 'Parts & Accessories', 'Refrigerator Parts & Accessories', 'Motors']",Refrigerator Motors,GE,Tools & Home Improvement,51.38,0.6,Positive,0.1,1.5,0.07
2746,5,,True,"10 31, 2015",A11IOXWLOWRGNT,B003BIGDEU,Reginald E. Kelley,OUR OVEN WORKS LIKE NEW!!! THANKS!!!,GREAT REPLACEMENT!!!,1446249600,"['Appliances', 'Parts & Accessories', 'Oven Parts & Accessories']",Oven Parts,GE,Tools & Home Improvement,28.03,0.8,Positive,0.9,1.8,0.46
2750,5,,True,"10 23, 2014",AUEKPBPKY0SI4,B003BIGDEU,Roger McCuistian,"Good price,and works great.","Good price, and works great",1414022400,"['Appliances', 'Parts & Accessories', 'Oven Parts & Accessories']",Oven Parts,GE,Tools & Home Improvement,28.03,0.8,Positive,0.9,0.9,0.76
2755,4,,True,"01 29, 2014",AMLSHM1JLN450,B003BIGDEU,Kody,"I bought this ignitor because I had to hit the old one with a screwdriver to get the oven to start. This one came quickly, but it is a different shape than the original one. It was a bit of a hassle removing the old bracket and jury rigging it to the new part to situate it so it would work. Once done it works great.",Fixed My Oven,1390953600,"['Appliances', 'Parts & Accessories', 'Oven Parts & Accessories']",Oven Parts,GE,Tools & Home Improvement,28.03,0.7,Positive,0.0,1.7,0.0
2760,5,,True,"03 13, 2013",AILLL1WM4XWZP,B003BIGDEU,TP Coltrain,"My oven started being finicky about heating and would make the loud ""whoomp"" sound as if it was filling up with too much gas before igniting it.

This new ignitor fixed it.

Based on my research, if your ignitor looks like this one then it is safe to assume it is a viable replacement.  Check them side-by-side when you receive it to make sure.",Solved my problem!,1363132800,"['Appliances', 'Parts & Accessories', 'Oven Parts & Accessories']",Oven Parts,GE,Tools & Home Improvement,28.03,0.5,Positive,0.1,1.5,0.07
2771,5,,True,"01 9, 2012",A34EJH19WC6ZWX,B003BIGDEU,Hans K,"When my oven burner wouldn't light anymore I didn't some online research to determine the problem.  I quickly concluded that it was more than likely the igniter.  I then researched the model # for a replacement igniter.  The replacement igniter cost around $60 so I did some more research and determined that I could use this igniter instead and it cost a lot less. I received the igniter, installed it and everything works great.  The research I did, showed that you can typically replace square igniters with other square igniters and round igniters with other round igniters.  From my research, it appears that square igniters draw one amount of current and round igniters draw a different amount of current.  Obviously keep a close eye on the general size so that the replacement will fit in and also look at the mounting bracket to make sure it's compatible.  Very happy with my purchase.",Works great and reasonable price,1326067200,"['Appliances', 'Parts & Accessories', 'Oven Parts & Accessories']",Oven Parts,GE,Tools & Home Improvement,28.03,0.7,Positive,0.1,3.1,0.03
2781,5,,True,"04 8, 2017",A38G63IKV1EQUP,B003BNZ55I,Dan,Absolutely over priced but does its job as a lint trap. Fast shipping but really should be no more than like 15 bucks. Plastic with the mesh screen. Our last one was broken so had to replace. Will hopefully last till the machine breaks down. Install of it is a flawed design which caused the failure of the last one.,Good lint trap but just expensive,1491609600,"['Appliances', 'Parts & Accessories', 'Dryer Parts & Accessories', 'Lint Screens']",Lint Screens,GE,Tools & Home Improvement,15.08,0.4,Positive,-0.4,2.8,-0.14
2784,5,,True,"09 19, 2016",A35B2WVVSRWHKU,B003BNZ55I,Momaearth,Really fast delivery and great price,Five Stars,1474243200,"['Appliances', 'Parts & Accessories', 'Dryer Parts & Accessories', 'Lint Screens']",Lint Screens,GE,Tools & Home Improvement,15.08,0.6,Positive,0.9,0.9,0.76
2790,1,,True,"02 9, 2015",A17UDXX2IJYGXT,B003BNZ55I,Shonda,Product came damaged. The wire mesh was not even connected to the plastic border. Very cheaply made. I do not recommend anyone buying this product. It was not worth trying to send back.,Not recommended...,1423440000,"['Appliances', 'Parts & Accessories', 'Dryer Parts & Accessories', 'Lint Screens']",Lint Screens,GE,Tools & Home Improvement,15.08,-0.9,Negative,-0.8,4.3,-0.18
2796,5,,True,"11 1, 2014",A1AECN3JCV80UE,B003BNZ55I,Andrea,"Perfect fit, just like the original.  Don't know how sturdy it will be since we just bought it.
 Saved $10 from the local dealers price.",Saved $10 from local price,1414800000,"['Appliances', 'Parts & Accessories', 'Dryer Parts & Accessories', 'Lint Screens']",Lint Screens,GE,Tools & Home Improvement,15.08,0.6,Positive,0.7,2.2,0.31
2797,3,,True,"08 14, 2014",A2ZMQLXTYNOF6W,B003BNZ55I,Derrick B. Holder,It was listed to fit all GE Dryers but this one did not fit my Dryer so I returned it and they charge me a 15% restocking fee.,Misleading in the Advertising.,1407974400,"['Appliances', 'Parts & Accessories', 'Dryer Parts & Accessories', 'Lint Screens']",Lint Screens,GE,Tools & Home Improvement,15.08,-0.6,Negative,-0.8,0.8,-0.76
2800,5,,True,"07 12, 2013",A1XAXEL581ZQY3,B003BNZ55I,Oldguy,"The old lint filter was getting out of shape and I decided to replace it with this one.
Unpacked it, dropped it into place and viola.

Didn't think that they would still distribute the filter, wrong thought, if Amazon doesn't have it, nobody has it.",Fit's like the old one only better,1373587200,"['Appliances', 'Parts & Accessories', 'Dryer Parts & Accessories', 'Lint Screens']",Lint Screens,GE,Tools & Home Improvement,15.08,0.2,Neutral,0.1,0.5,0.2
2803,5,,True,"05 17, 2013",ATLJ60FEHPD1R,B003BNZ55I,sb,I received the filter in the mail USPS within 2 days of placing order. Fantastic! I didn't have to pay for priority shipment and got great delivery time. The filter I ordered for my GE dryer turned out to have been made by GE and was half the price that GE was charging. It fit perfectly. It did not have any sharp or exposed edges as reported by other reviewers.,"Exact Replacement, Made By GE",1368748800,"['Appliances', 'Parts & Accessories', 'Dryer Parts & Accessories', 'Lint Screens']",Lint Screens,GE,Tools & Home Improvement,15.08,0.6,Positive,0.5,4.4,0.11
2807,5,,True,"08 9, 2013",A2FKDF1LATYNWY,B003DA61YI,Tonya Hoffman,"The drip bowls fit well, and looks nice. I am very happy with this purchase.  I bought the large and small sets.",Pleased,1376006400,"['Appliances', 'Parts & Accessories', 'Range Parts & Accessories', 'Drip Pans']",Drip Pans,Whirlpool,Tools & Home Improvement,6.78,0.8,Positive,0.6,1.9,0.31
2813,5,,True,"01 17, 2015",A1JWLUFIZQ48XQ,B003DA61YI,Aleks,Awesome fits perfectly and the color looks really nice along with the material which is a very good quality and makes it easy to clean.,Perfect,1421452800,"['Appliances', 'Parts & Accessories', 'Range Parts & Accessories', 'Drip Pans']",Drip Pans,Whirlpool,Tools & Home Improvement,6.78,0.8,Positive,0.9,0.9,0.76
2823,5,,True,"03 30, 2016",AOTIGLCOU4EBH,B003EAJSY2,Glennm,"Seem to be exact replacement for original knobs.  Bought two in case another one fails but so far, so good.",so good.,1459296000,"['Appliances', 'Parts & Accessories', 'Range Parts & Accessories', 'Knobs']",Range Knobs,FSP,Tools & Home Improvement,13.9,0.4,Positive,0.8,1.7,0.44
2824,5,,True,"06 24, 2015",A1NMCT6YEK0H9W,B003EAJSY2,Brenda,IT WORK WILL GOOD,Five Stars,1435104000,"['Appliances', 'Parts & Accessories', 'Range Parts & Accessories', 'Knobs']",Range Knobs,FSP,Tools & Home Improvement,13.9,0.7,Positive,0.8,0.8,0.76
2826,3,6,True,"06 30, 2013",A247IY6VFH0W2J,B003EAJSY2,Simon F. Rodehn,"Even though this replaces the original well it remains, like the original, a cheap easily broken item. The first replacement broke quite soon after being installed so I ordered several and have gone through a number since. The portion which pops onto the stem could easily have been made a bit thicker. I use cable ties to prolong the use of the ones that do not break completely.",Replaces the original well,1372550400,"['Appliances', 'Parts & Accessories', 'Range Parts & Accessories', 'Knobs']",Range Knobs,FSP,Tools & Home Improvement,13.9,-0.5,Negative,-0.2,0.8,-0.24
2828,2,4,True,"05 3, 2012",A38754C78HLXXP,B003EAJSY2,Mike in San Diego,"Jenn-Air is owned by Maytag and, I assume, is meant to be higher end.  That has not been my experience with either my somewhat expensive Jenn-Air stove and Range top.  The new knobs replaced the original knobs on my range top.  The originals were cheaply made, worked loose and broke easily.  The new ones fit nice and tight, but are the same as the original cheaply made ones and started showing ""play"" within a few weeks.  At least I now know where to get new ones again when these break.",Now I know how the Maytag repairman makes a good living,1336003200,"['Appliances', 'Parts & Accessories', 'Range Parts & Accessories', 'Knobs']",Range Knobs,FSP,Tools & Home Improvement,13.9,-0.6,Negative,-0.1,3.3,-0.03
2829,4,,True,"05 29, 2014",A2XWJQ0BY2T11G,B003PEAPQC,Zeegee,Reasonably priced on amazon. It's more expensive in stores. The shipping was quick too. I will be buying these again in the future.,Filter,1401321600,"['Appliances', 'Parts & Accessories', 'Range Hood Parts & Accessories', 'Filters']",Range Filters,Broan,Tools & Home Improvement,8.18,0.5,Positive,0.5,3.3,0.15
2831,4,,True,"10 1, 2014",A1FZY8QLCVOE7Z,B003XZTOJW,Erma J.Jackson,"The maytag drain pump motor fit perfectly and is working properly. I had looked for a replace at other stores, but finally found it on Amazon...Thanks..my shopping experience, as always, was excellent..",was excellent..,1412121600,"['Appliances', 'Parts & Accessories', 'Washer Parts & Accessories', 'Drain Pumps']",Drain Pumps,Maytag,Appliances,42,0.6,Positive,0.9,1.9,0.44
2848,5,,True,"01 29, 2016",A33KGSVB0KEHOR,B003ZVSEPE,Mike Schreiber,Exactly what I needed to get the machine running again. Thanks for the great price on the pump and belts.,Great value for the money,1454025600,"['Appliances', 'Parts & Accessories', 'Washer Parts & Accessories', 'Drain Pumps']",Drain Pumps,Maytag,Tools & Home Improvement,32.7,0.6,Positive,0.9,1.9,0.44
2850,1,,True,"02 15, 2014",A2X35ELB0II3OV,B003ZVSEPE,pinSeeker,"This pump was poorly constructed with cheap, light-weight parts. The pulley came off the pump the first time it was used.  I had to buy another from my local Maytag store.  It cost twice as much as this one, but it worked.",Water Pump,1392422400,"['Appliances', 'Parts & Accessories', 'Washer Parts & Accessories', 'Drain Pumps']",Drain Pumps,Maytag,Tools & Home Improvement,32.7,-0.8,Negative,-0.3,2.9,-0.1
2852,4,,True,"03 14, 2013",A1IQRRQCHDW2T5,B0044R7U80,Lili Rios,It just plops right in to the space it belongs in the humidifier. It seems like an easy maintenance item.,"So far, so good.",1363219200,"['Appliances', 'Parts & Accessories', 'Humidifier Parts & Accessories', 'Replacement Wicks']",Replacement Wicks,Optimus,Amazon Home,17.84,0.5,Positive,0.5,1.0,0.46
2855,5,39,True,"05 20, 2010",AYRY5A0TNF40N,B0045ALLYA,Michael Peterson,"Every other small refrigerator seems to come with a useless tiny freezer and frosting problems.  Not this one!!!  It's high-tech, inexpensive, and absolutely perfect for a small dorm room or office.  Apparently it uses a different cooling system.",The Best Small Fridge EVER,1274313600,"['Appliances', 'Refrigerators, Freezers & Ice Makers', 'Refrigerators']",Refrigerators,Avanti,Appliances,38.65,0.8,Positive,-0.2,2.8,-0.07
2862,4,,True,"07 28, 2013",A2OIPGZUJH9M14,B004DNWVMA,Captain Brannigan,"Needed to find a 12ft dishwasher, hose, and it seems that no one is making them. I didn't want to take a chance of leakage by connecting two 6ft hoses together. Its nice design, very flexible.",Pretty good.,1374969600,"['Appliances', 'Parts & Accessories', 'Dishwasher Parts & Accessories', 'Hoses']",Dishwasher Hoses,Whirlpool,Tools & Home Improvement,27.78,0.6,Positive,0.0,1.9,0.0
2878,5,,True,"03 18, 2017",A1JJCYUPMMBV9D,B004JNU22A,Den,Perfect fit replacement,Five Stars,1489795200,"['Appliances', 'Parts & Accessories', 'Range Parts & Accessories', 'Burners']",Burners,ERP,Tools & Home Improvement,12.95,0.7,Positive,0.9,0.9,0.76
2885,5,,True,"01 26, 2016",A2YOPNFZBTDR1X,B004JNU22A,visionmaster,Really is an exact replacement. Love it.,Love it.,1453766400,"['Appliances', 'Parts & Accessories', 'Range Parts & Accessories', 'Burners']",Burners,ERP,Tools & Home Improvement,12.95,0.8,Positive,0.9,1.8,0.46
2890,4,,True,"03 27, 2015",A2F3H63MYPZQFJ,B004JNU22A,Paul Kruger,Worked ... what more could I ask for.,Gets Hot...of course,1427414400,"['Appliances', 'Parts & Accessories', 'Range Parts & Accessories', 'Burners']",Burners,ERP,Tools & Home Improvement,12.95,0.8,Positive,0.6,1.2,0.46
2893,3,,True,"10 19, 2014",A17UZIT1PAEJDU,B004JNU22A,Mom,not sure that these are really exact replacements. don't sit flat in drip pan.....but they look good and seem to work properly.,"Similar, not exact",1413676800,"['Appliances', 'Parts & Accessories', 'Range Parts & Accessories', 'Burners']",Burners,ERP,Tools & Home Improvement,12.95,0.2,Neutral,0.0,1.2,0.0
2910,5,,True,"08 30, 2016",A12T1ITQGUGDL5,B004JOHPV0,Asa Kelly,Exact replacement. Easy to install and solved the problem!,Perfect replacement for bad motor,1472515200,"['Appliances', 'Parts & Accessories', 'Refrigerator Parts & Accessories', 'Motors']",Refrigerator Motors,Samsung,Tools & Home Improvement,65.98,0.7,Positive,0.8,1.7,0.44
2920,5,,True,"12 2, 2014",ALA46S4IKKGSA,B004JOHPV0,dsnylvr,Refrigerator is running great now!,Five Stars,1417478400,"['Appliances', 'Parts & Accessories', 'Refrigerator Parts & Accessories', 'Motors']",Refrigerator Motors,Samsung,Tools & Home Improvement,65.98,0.7,Positive,0.9,0.9,0.76
2931,3,,True,"05 3, 2015",A1Z479TLJZ27G3,B004KSL51G,Paul Bunyan,Perfectly adequate alternative to the outrageously expensive Sub-Zero OEM part.,Yes!,1430611200,"['Appliances', 'Parts & Accessories', 'Refrigerator Parts & Accessories', 'Motors']",Refrigerator Motors,Supco,Tools & Home Improvement,28.95,0.7,Positive,0.9,0.9,0.76
2936,5,,True,"03 12, 2013",AG4Q6H2NQU5AP,B004KSL51G,Mahidoodi,"I bought this for an old Subzero fridge that nobody carries the part for anymore, not even Subzero.  There is not much on the description of this item but I took a chance and bought it.  Everything except the amp rating is about the same as the old part.  I installed it using the blade from the old motor and it worked perfectly.  The fridge is back and it is cooling fine.",Works Great,1363046400,"['Appliances', 'Parts & Accessories', 'Refrigerator Parts & Accessories', 'Motors']",Refrigerator Motors,Supco,Tools & Home Improvement,28.95,0.6,Positive,0.1,1.9,0.05
2951,4,,True,"06 14, 2015",A1P1GT6MPCWWLZ,B004W6IKGE,S. W.,It is a little snug but works fine and looks just like the old one. Much better price too.,Great Oven Knob,1434240000,"['Appliances', 'Parts & Accessories', 'Range Parts & Accessories', 'Knobs']",Range Knobs,GE,Tools & Home Improvement,24.45,0.6,Positive,0.9,1.8,0.46
2952,4,,True,"01 5, 2015",AOXAN46ZXWCBD,B004W6IKGE,Amazon Customer,"Great knobs, quick delivery",Four Stars,1420416000,"['Appliances', 'Parts & Accessories', 'Range Parts & Accessories', 'Knobs']",Range Knobs,GE,Tools & Home Improvement,24.45,0.6,Positive,0.9,0.9,0.76
2958,4,,True,"01 17, 2017",AQQ3EJ5TG0K9A,B004W6IKIC,Amazon Customer,The knobs don't fit flushed to the stove but operates fine.,... knobs don't fit flushed to the stove but operates fine.,1484611200,"['Appliances', 'Parts & Accessories', 'Range Parts & Accessories', 'Knobs']",Range Knobs,GE,Tools & Home Improvement,25.92,0.5,Positive,0.0,0.0,
2961,3,,True,"12 15, 2015",AN0CHAMZHPOI5,B004W6IKIC,Nate,"Fits the stove, incredibly over priced",Three Stars,1450137600,"['Appliances', 'Parts & Accessories', 'Range Parts & Accessories', 'Knobs']",Range Knobs,GE,Tools & Home Improvement,25.92,-0.4,Negative,-0.7,0.7,-0.76
2974,1,,True,"04 7, 2018",A38W0V73G0FEOF,B004W7UWIM,Tasha C.,I have a GE fridge and the adapters were too big,One Star,1523059200,"['Appliances', 'Parts & Accessories', 'Range Parts & Accessories', 'Knobs']",Range Knobs,Aqua Plumb,Tools & Home Improvement,10.43,-0.7,Negative,-0.8,0.8,-0.76
2975,3,,True,"04 6, 2018",AABXEK53N7DNI,B004W7UWIM,Zaman Family,It didn't work for my stove.,Didnt have my size,1522972800,"['Appliances', 'Parts & Accessories', 'Range Parts & Accessories', 'Knobs']",Range Knobs,Aqua Plumb,Tools & Home Improvement,10.43,-0.7,Negative,-0.8,0.8,-0.76
