Serial No,ratings,vote,verified,reviewTime,reviewerID,asin,reviewerName,reviewText,summary,unixReviewTime,category,product type,brand,main_cat,price,Human Sentiment Score,Review Type,Sentiment_Score,Sentiment_Magnitude,Normalized_Sentiment_Scores
13,5,,True,"11 2, 2017",A2JNAQKXQI16DI,B00009W3HD,souad jatkr,Thank you,Five Stars,1509580800,"['Appliances', 'Parts &amp; Accessories', 'Dryer Parts &amp; Accessories', 'Vents']",Dryer Vents,Deflecto,Tools &amp; Home Improvement,13.9,0.3,Positive,0.8,0.8,0.76
14,5,,True,"10 6, 2017",A1YVEHHNGR3A6D,B00009W3HD,Amazon Customer,so nice not to have to cut a hole in the garage wall of our rental plus my Audi doesn't get lint all over it!,so nice not to have to cut a hole in the ...,1507248000,"['Appliances', 'Parts &amp; Accessories', 'Dryer Parts &amp; Accessories', 'Vents']",Dryer Vents,Deflecto,Tools &amp; Home Improvement,13.9,0.6,Positive,0.9,0.9,0.76
15,4,,True,"09 5, 2017",AH072GXF0C0E5,B00009W3HD,Joyce,Exactly what I expected. Easy to put together,Easy to put,1504569600,"['Appliances', 'Parts &amp; Accessories', 'Dryer Parts &amp; Accessories', 'Vents']",Dryer Vents,Deflecto,Tools &amp; Home Improvement,13.9,0.8,Positive,0.9,1.8,0.46
16,4,2,True,"08 20, 2017",A2D1EO101DAN1B,B00009W3HD,Amazon Customer,Look good the pipe is a bit short,Four Stars,1503187200,"['Appliances', 'Parts &amp; Accessories', 'Dryer Parts &amp; Accessories', 'Vents']",Dryer Vents,Deflecto,Tools &amp; Home Improvement,13.9,0.3,Positive,0.0,0.0,
20,5,,True,"04 1, 2017",A3JH3WLGE0HHDN,B00009W3HD,Brian,"When you live in an apartment, or have need supplemental heat during the winter, this little device is for you.  The lint trap is designed to catch any excess lint coming out of the dryer and disperse heat throughout the room from the dryer.  As my dryer is not vented to the outside, this was an absolute MUST for me.  I love it!",A must have for apartment dwellers or anyone whose dryer does not vent to the outside!,1491004800,"['Appliances', 'Parts &amp; Accessories', 'Dryer Parts &amp; Accessories', 'Vents']",Dryer Vents,Deflecto,Tools &amp; Home Improvement,13.9,0.7,Positive,0.6,3.0,0.2
23,5,,True,"09 5, 2016",A1YSCQBOH14RON,B00009W3HD,Nelda Adams,Did not have to put a hole in side of our camper.,Five Stars,1473033600,"['Appliances', 'Parts &amp; Accessories', 'Dryer Parts &amp; Accessories', 'Vents']",Dryer Vents,Deflecto,Tools &amp; Home Improvement,13.9,0.4,Positive,0.7,0.7,0.76
28,4,,True,"08 6, 2015",A1JSQ3STF8TB80,B00009W3HD,Jan,I seems to be working quite well.,Four Stars,1438819200,"['Appliances', 'Parts &amp; Accessories', 'Dryer Parts &amp; Accessories', 'Vents']",Dryer Vents,Deflecto,Tools &amp; Home Improvement,13.9,0.5,Positive,0.8,0.8,0.76
29,2,,True,"08 5, 2015",A1RF1E1TI5OC0N,B00009W3HD,Levinz11,This product is pretty much a piece of junk. They state it comes with a 5' hose but it's more like 3'. Not even long enough to mount the lint trap on the wall above the dryer. I have it sitting on the floor next to dryer. The zip ties are also total crap and do not secure the hose to the dryer or lint trap. I had to use zip ties. I'm not returning it because I need it for now but I'd recommend a different lint trap if you need one of these type products due to no exterior vent.,This product is pretty much a piece of junk,1438732800,"['Appliances', 'Parts &amp; Accessories', 'Dryer Parts &amp; Accessories', 'Vents']",Dryer Vents,Deflecto,Tools &amp; Home Improvement,13.9,-0.9,Negative,-0.6,4.6,-0.13
35,1,,True,"02 23, 2015",AXP8WXVHLF8MJ,B00009W3HD,guest,"Very flimsy attachments, difficult to attach without coming off",One Star,1424649600,"['Appliances', 'Parts &amp; Accessories', 'Dryer Parts &amp; Accessories', 'Vents']",Dryer Vents,Deflecto,Tools &amp; Home Improvement,13.9,-0.9,Negative,-0.8,0.8,-0.76
38,3,,True,"11 20, 2014",AKRB5KR3ERHNX,B00009W3HD,sally peterson,"Cheap, already broke",Three Stars,1416441600,"['Appliances', 'Parts &amp; Accessories', 'Dryer Parts &amp; Accessories', 'Vents']",Dryer Vents,Deflecto,Tools &amp; Home Improvement,13.9,-0.8,Negative,-0.6,0.6,-0.76
42,5,,True,"12 15, 2013",A2WTWNQ5YX0U3J,B00009W3HD,amazon customer,"Had this item for about 4 years.  Every winter we connect it to the dryer duct to re-direct the dryer heat inside.  Our dryer is in the mud room of the first floor and there is some moisture condensation for the beginning of the cycle but the dampness is useful to counter balance the dryness from the forced hot air from our home's heat pump.  We make sure the connections are secure because sometimes extra lint or dust can escape.  Also, we use an old pantyhose around the box as another filter to catch more lint.",saves heating bill; adds moisture,1387065600,"['Appliances', 'Parts &amp; Accessories', 'Dryer Parts &amp; Accessories', 'Vents']",Dryer Vents,Deflecto,Tools &amp; Home Improvement,13.9,0.9,Positive,0.2,1.3,0.15
43,1,7,True,"04 1, 2013",A3EATZMITBG525,B00009W3HD,El Jimbo,"We did not have a dryer vent in our new condo. Wish I had noticed that before we moved in. This seemed to be the only option and it is barely adequate. It does catch a lot of the lint but fine particles seem to escape at will. We have to dust the condo after every wash day. I didn't see any better options out there.

By the way, it is cheaply made, be gentle with it or you will mess it up.

*****Update****

After using this thing for about 9 months we have decided to stop using our dryer in the condo. I changed it from 3 stars to 1. It just doesn't catch enough lint and when we did a spring cleaning by moving furniture and the washer / dryer to clean up dust bunnies it was obvious it does a very poor job of eliminating lint from escaping into the rest of our condo. It was gross, and to think we've been breathing that stuff in. And, yes, we followed instructions, made sure there was plenty of water in the basin and we cleaned it out each time we used it. I do not recommend this product. We prefer going to the laundry building in our complex rather than use the dryer with the lint catcher.","No longer using it, it just doesn't do the job",1364774400,"['Appliances', 'Parts &amp; Accessories', 'Dryer Parts &amp; Accessories', 'Vents']",Dryer Vents,Deflecto,Tools &amp; Home Improvement,13.9,-0.9,Negative,-0.4,7.8,-0.05
49,4,,True,"05 2, 2016",A1K5L5FQJX2BFM,B0000ALEVA,Randall Hunte,Practical,Four Stars,1462147200,"['Appliances', 'Parts &amp; Accessories', 'Dishwasher Parts &amp; Accessories', 'Baskets']",Dishwasher Basket,Prince Lionheart,Baby,15.79,0.5,Positive,0.8,0.8,0.76
57,5,,True,"02 22, 2012",AALRHWC7V1MVE,B0000ALEVA,ABG,"I don't use the round thing (I guess it's for sippy cups), but I use the other two for Dr Brown bottles and Medela pumping supplies.  No complaints so far, it just does what it should!",Great!,1329868800,"['Appliances', 'Parts &amp; Accessories', 'Dishwasher Parts &amp; Accessories', 'Baskets']",Dishwasher Basket,Prince Lionheart,Baby,15.79,0.3,Positive,0.5,1.1,0.43
60,5,11,True,"12 16, 2010",A1KWLSHD6O5V9J,B0000TN7NS,PJD,"Like a lot of people, I have allergies and during the winter need to keep the humidity level between 30-40%. Higher humidity helps in that it keeps me from shocking my dogs and cats when I touch them. This is working great ! I have taken it from room to room to get the reading on each room so I'll know how much humidity I need to add to the air etc. The numbers are easy to read which is plus. I'd order this again and recommend it highly.",Works great !,1292457600,"['Appliances', 'Parts &amp; Accessories', 'Humidifier Parts &amp; Accessories', 'Humidity Meters']",Humidity Meters,Vicks,Health &amp; Personal Care,11.59,0.9,Positive,0.6,3.9,0.15
65,5,,True,"12 4, 2016",A1UAAV9UD8MKRY,B0000TN7NS,Amazon Customer,Super,Five Stars,1480809600,"['Appliances', 'Parts &amp; Accessories', 'Humidifier Parts &amp; Accessories', 'Humidity Meters']",Humidity Meters,Vicks,Health &amp; Personal Care,11.59,0.9,Positive,0.9,0.9,0.76
70,4,,True,"01 22, 2016",A3DJ6KOU5PSFAS,B0000TN7NS,Angela Dublin,Does well,Four Stars,1453420800,"['Appliances', 'Parts &amp; Accessories', 'Humidifier Parts &amp; Accessories', 'Humidity Meters']",Humidity Meters,Vicks,Health &amp; Personal Care,11.59,0.6,Positive,0.9,0.9,0.76
71,1,,True,"01 13, 2016",A2MA5H3EPXVTJ0,B0000TN7NS,ALINA Z,I have three of these and they show different numbers at the same place.,One Star,1452643200,"['Appliances', 'Parts &amp; Accessories', 'Humidifier Parts &amp; Accessories', 'Humidity Meters']",Humidity Meters,Vicks,Health &amp; Personal Care,11.59,-0.7,Negative,-0.3,0.3,-0.76
75,3,,True,"10 8, 2015",ADCT4DDSPBBZO,B0000TN7NS,SLM,We own two and sadly one stopped working after two years.,Three Stars,1444262400,"['Appliances', 'Parts &amp; Accessories', 'Humidifier Parts &amp; Accessories', 'Humidity Meters']",Humidity Meters,Vicks,Health &amp; Personal Care,11.59,0.3,Positive,-0.8,0.8,-0.76
91,2,,True,"03 24, 2015",A1XPT6TAPFPPEM,B0000TN7NS,Penguin60,"humidity monitor works, temp is not accurate",Two Stars,1427155200,"['Appliances', 'Parts &amp; Accessories', 'Humidifier Parts &amp; Accessories', 'Humidity Meters']",Humidity Meters,Vicks,Health &amp; Personal Care,11.59,0.2,Neutral,-0.8,0.8,-0.76
100,5,,True,"01 11, 2015",A20A5WWCB180WM,B0000TN7NS,Joseph Page,Easy to read!,Great for the nursery!,1420934400,"['Appliances', 'Parts &amp; Accessories', 'Humidifier Parts &amp; Accessories', 'Humidity Meters']",Humidity Meters,Vicks,Health &amp; Personal Care,11.59,0.6,Positive,0.9,0.9,0.76
101,5,,True,"01 9, 2015",A3JKNQ588Q3OGW,B0000TN7NS,C. Bradshaw,Works well to tell you the temp of an area.,Good Buy,1420761600,"['Appliances', 'Parts &amp; Accessories', 'Humidifier Parts &amp; Accessories', 'Humidity Meters']",Humidity Meters,Vicks,Health &amp; Personal Care,11.59,0.6,Positive,0.9,0.9,0.76
103,5,,True,"12 5, 2014",A2H667ZUNLNTF1,B0000TN7NS,Wendi Barker,"I use this together with a humidifier when someone in the family comes down with a cold.  It shows me what the current humidity and temperature is so I can adjust the humidifier to get the perfect moisture in the air for the room.

I love the guide along the bottom.  It shows the ranges for too dry, just right, ideal for when you have a cold and too moist.  SO helpful and easy to read!","Works Great, Use it to Control Humidity in Room When We Have Colds",1417737600,"['Appliances', 'Parts &amp; Accessories', 'Humidifier Parts &amp; Accessories', 'Humidity Meters']",Humidity Meters,Vicks,Health &amp; Personal Care,11.59,0.6,Positive,0.8,4.2,0.19
104,4,,True,"11 23, 2014",ABIJIQNDJJ51M,B0000TN7NS,amazonuser,Delivered on time and works as expected,Four Stars,1416700800,"['Appliances', 'Parts &amp; Accessories', 'Humidifier Parts &amp; Accessories', 'Humidity Meters']",Humidity Meters,Vicks,Health &amp; Personal Care,11.59,0.7,Positive,0.7,0.7,0.76
117,1,4,True,"07 30, 2014",A32U5KVA3FL9OG,B0000TN7NS,David A. Holcomb,I purchased this about three weeks ago.  The humidity indicator always reads in the mid teens.  I live in NW Florida where humidity levels are usually in the 60's to 80's.  I should have heeded past reviewers complaints of a faulty product.  This is junk.,I purchased this about three weeks ago. The humidity ...,1406678400,"['Appliances', 'Parts &amp; Accessories', 'Humidifier Parts &amp; Accessories', 'Humidity Meters']",Humidity Meters,Vicks,Health &amp; Personal Care,11.59,-0.9,Negative,-0.3,1.7,-0.17
121,4,,True,"04 17, 2014",A2ZM57F91CHTDK,B0000TN7NS,J. Nyberg,I have had other digital devices that disappointed me.  This machine has been the most accurate and responsive to the sensing and display of changing humidity and temperature. Started up without failure and hasn't failed yet (1-1/2 months). Good purchase.,Seems very responsive,1397692800,"['Appliances', 'Parts &amp; Accessories', 'Humidifier Parts &amp; Accessories', 'Humidity Meters']",Humidity Meters,Vicks,Health &amp; Personal Care,11.59,0.5,Positive,0.6,3.0,0.2
122,5,,True,"04 4, 2014",A2ITS2CJX3Y3WP,B0000TN7NS,eala,The monitor works right out of the box and starts reading within a minute of powering up.  I like that it shows not only what it is but what is recommended.,Just what we needed.,1396569600,"['Appliances', 'Parts &amp; Accessories', 'Humidifier Parts &amp; Accessories', 'Humidity Meters']",Humidity Meters,Vicks,Health &amp; Personal Care,11.59,0.8,Positive,0.9,1.8,0.46
131,5,,True,"01 17, 2013",A62COSCXOXCD6,B0000TN7NS,John Newcomer,"Works well, easy to read and reasonably priced. Our home humidifier does not have a digital display. This monitor gives a very accurate sense of how well it is working. I would buy it again.",Happy with Monitor,1358380800,"['Appliances', 'Parts &amp; Accessories', 'Humidifier Parts &amp; Accessories', 'Humidity Meters']",Humidity Meters,Vicks,Health &amp; Personal Care,11.59,0.8,Positive,0.5,3.4,0.15
133,5,,True,"08 10, 2011",A1XQKOSGABHOJU,B0000TN7NS,John Covino,Use these throughout the house in winter.  We burn wood via woodstove so house gets really dry.  This lets us know just how dry the house is to increase the humidity as needed.,Good monitor,1312934400,"['Appliances', 'Parts &amp; Accessories', 'Humidifier Parts &amp; Accessories', 'Humidity Meters']",Humidity Meters,Vicks,Health &amp; Personal Care,11.59,0.5,Positive,0.5,2.0,0.24
138,3,10,True,"08 3, 2010",AYRWWC1I4T14X,B000274JT4,newgrandma,"Six years ago, when we purchased our GE Monogram compactor, it came with bags. They were very thick, the bottoms were pleated for perfect fit and they had holes for the ""buttons"" on the sides to keep the bags from sliding when compacting. For a couple of years, we could purchase similar bags from GE, but they were pretty costly for such an item. What has happened, GE? Thinner bags, flat, with no holes. It was a lot of work to make the bag fit--well, almost fit. Half the price, I have to admit, but then, you get what you pay for. I am tempted to order directly from GE and see if there is a difference. I am wondering if GE provides these bags of poorer quality so they can be sold cheaper. (I used amazon, because it was easy. The bags came quickly, no complaint there.)","GE bags, really?",1280793600,"['Appliances', 'Parts & Accessories', 'Trash Compactor Parts & Accessories']",Trash Compactor,GE,Tools & Home Improvement,23.75,-0.5,Negative,0.0,3.8,0.0
140,4,,True,"04 18, 2010",A1BIA3FEOKSNLZ,B0002D000K,Melissa,very handy device to understand humidity levels in your home.  I moved it form room to room to understand humidity patterns in home.,handy little device,1271548800,"['Appliances', 'Parts & Accessories', 'Humidifier Parts & Accessories', 'Accessories']",Humidifier Accessories,D'Addario Accessories,Musical Instruments,16.99,0.6,Positive,0.4,1.0,0.38
141,4,,True,"06 7, 2014",A3TM9RWCTMIK42,B0002D000K,Jeffrey,A must buy if you want to know what the humidity is inside a guitar case. No more guessing involved and fairly well constructed.,Hygrometer Humidity Senor,1402099200,"['Appliances', 'Parts & Accessories', 'Humidifier Parts & Accessories', 'Accessories']",Humidifier Accessories,D'Addario Accessories,Musical Instruments,16.99,0.5,Positive,0.9,1.9,0.44
143,3,,True,"10 26, 2013",A16GSR63P6A46J,B0002D000K,David A. Darbyshire,"Hard to read, but does give you the humidity in your case.  I think I would look for a different one, if I were to buy again.",So So,1382745600,"['Appliances', 'Parts & Accessories', 'Humidifier Parts & Accessories', 'Accessories']",Humidifier Accessories,D'Addario Accessories,Musical Instruments,16.99,-0.7,Negative,-0.2,0.7,-0.28
157,5,,True,"08 13, 2015",A24RWWH4D8L5TV,B0002EAL58,Loveapple,"This is a good thing I bought. Turn a friger into a refrigerator, and it's been serving well since.",Five Stars,1439424000,"['Appliances', 'Parts & Accessories', 'Freezer Parts & Accessories']",Freezer Parts,Jonson Controls,Industrial & Scientific,62.21,0.7,Positive,0.8,1.7,0.44
158,5,,True,"07 22, 2015",A2S3JVFIX1U7A7,B0002EAL58,Dene Bourn,"Works just as it's suppose to , our old freezer is now an energy efficient refrig .",Five Stars,1437523200,"['Appliances', 'Parts & Accessories', 'Freezer Parts & Accessories']",Freezer Parts,Jonson Controls,Industrial & Scientific,62.21,0.6,Positive,0.9,0.9,0.76
159,5,,True,"07 12, 2015",A2K8TG7T8108BJ,B0002EAL58,Aldo Lopez,works great. fridge is at a stable temperature now.,Five Stars,1436659200,"['Appliances', 'Parts & Accessories', 'Freezer Parts & Accessories']",Freezer Parts,Jonson Controls,Industrial & Scientific,62.21,0.7,Positive,0.7,1.5,0.44
163,5,,True,"05 24, 2015",A2LF8UCU952WHN,B0002EAL58,Suchismita Rath,works as expected for past 2+ years,Five Stars,1432425600,"['Appliances', 'Parts & Accessories', 'Freezer Parts & Accessories']",Freezer Parts,Jonson Controls,Industrial & Scientific,62.21,0.7,Positive,0.7,0.7,0.76
164,5,,True,"05 12, 2015",A2IGD9JPE559DL,B0002EAL58,Steelution,These are great for turning a chest freezer into a fridge!  Extremely low-power!,Five Stars,1431388800,"['Appliances', 'Parts & Accessories', 'Freezer Parts & Accessories']",Freezer Parts,Jonson Controls,Industrial & Scientific,62.21,0.8,Positive,0.3,1.2,0.24
168,5,,True,"11 5, 2014",A2377KUOP8KIS5,B0002EAL58,Andrew C.,Converted a box freezer into a kegerator with the temperature controller. Works well.,Five Stars,1415145600,"['Appliances', 'Parts & Accessories', 'Freezer Parts & Accessories']",Freezer Parts,Jonson Controls,Industrial & Scientific,62.21,0.6,Positive,0.4,1.0,0.38
171,5,,True,"07 14, 2014",A2QCFU3HXNAJ8E,B0002EAL58,M. Cheeseman,Worked well. Easy to install.,Easy to install,1405296000,"['Appliances', 'Parts & Accessories', 'Freezer Parts & Accessories']",Freezer Parts,Jonson Controls,Industrial & Scientific,62.21,0.6,Positive,0.9,1.8,0.46
181,5,,True,"04 12, 2013",A2UIRY5AXKNZLQ,B0002EAL58,Eric R. Caron,I set my freezer down to zero and then set up the control where I like my beer 55F and it does the rest. Set it and forget it.,Does exactly what it is supposed to do,1365724800,"['Appliances', 'Parts & Accessories', 'Freezer Parts & Accessories']",Freezer Parts,Jonson Controls,Industrial & Scientific,62.21,0.8,Positive,0.0,0.4,0.0
195,5,,True,"01 12, 2017",A2A6FAOOXE68TJ,B0002GTTRC,Laura Vergeront,Fit like a glove and easy to install.  the last one lasted 3years,perfect for the GE frigs,1484179200,"['Appliances', 'Parts &amp; Accessories', 'Refrigerator Parts &amp; Accessories', 'Water Filters']",Water filters,General Electric,Tools &amp; Home Improvement,39.98,0.7,Positive,0.2,1.4,0.14
210,5,,True,"12 21, 2015",A38X1DVZ4IJCWO,B0002GTTRC,BIG MONKEY,Worked perfectly on my GE Profile fridge. Water had a slight residual taste to it at the beginning but all's now.,Worked perfectly on my GE Profile fridge. Water had ...,1450656000,"['Appliances', 'Parts &amp; Accessories', 'Refrigerator Parts &amp; Accessories', 'Water Filters']",Water filters,General Electric,Tools &amp; Home Improvement,39.98,0.6,Positive,0.7,1.4,0.46
213,5,,True,"10 19, 2015",A3UNR2XY2ZI5UR,B0002GTTRC,Poorer but Wiser,"These are genuine GE filters, not ""compatibles.""  This was also the best price I found for genuine filters.",Genuine GE filters.,1445212800,"['Appliances', 'Parts &amp; Accessories', 'Refrigerator Parts &amp; Accessories', 'Water Filters']",Water filters,General Electric,Tools &amp; Home Improvement,39.98,0.5,Positive,0.5,1.0,0.46
215,5,,True,"08 2, 2015",A2NT7FBO42GCY3,B0002GTTRC,Chris in the Morning,"Right filter, right price, works great.  I can't ask for anything else.  I usually go to Sears for the replacement filter since I bought the refrigerator there.  Sears keeps moving the filters and last time I had to go to a desk where the rep went into the back area to get the filter.  It took 5 minutes for him to find it and the water flow was very restricted.  I decided to eliminate the hassle of driving, requesting and waiting.",works great. I can't ask for anything else,1438473600,"['Appliances', 'Parts &amp; Accessories', 'Refrigerator Parts &amp; Accessories', 'Water Filters']",Water filters,General Electric,Tools &amp; Home Improvement,39.98,0.8,Positive,0.0,3.7,0.0
218,5,,True,"06 19, 2015",A2HOH37YG4S9CW,B0002GTTRC,Jo,Great product.,Five Stars,1434672000,"['Appliances', 'Parts &amp; Accessories', 'Refrigerator Parts &amp; Accessories', 'Water Filters']",Water filters,General Electric,Tools &amp; Home Improvement,39.98,0.7,Positive,0.9,0.9,0.76
224,4,,True,"04 7, 2015",AVBEGZ6R4B61V,B0002GTTRC,The biggest of the big,so far so good ...bought it through a reseller on amazon and it seems legit,Four Stars,1428364800,"['Appliances', 'Parts &amp; Accessories', 'Refrigerator Parts &amp; Accessories', 'Water Filters']",Water filters,General Electric,Tools &amp; Home Improvement,39.98,0.7,Positive,0.9,0.9,0.76
235,4,,True,"10 26, 2014",A267BR0F6ATA0O,B0002GTTRC,Maryanne deluca,Short life span for the amount of money they charge,Four Stars,1414281600,"['Appliances', 'Parts &amp; Accessories', 'Refrigerator Parts &amp; Accessories', 'Water Filters']",Water filters,General Electric,Tools &amp; Home Improvement,39.98,-0.6,Negative,-0.4,0.4,-0.76
239,3,,True,"07 30, 2014",A2PAOKIY0NGFG3,B0002GTTRC,Lee,Quick service and nice price.,Three Stars,1406678400,"['Appliances', 'Parts &amp; Accessories', 'Refrigerator Parts &amp; Accessories', 'Water Filters']",Water filters,General Electric,Tools &amp; Home Improvement,39.98,0.6,Positive,0.8,0.8,0.76
240,5,,True,"07 25, 2014",AMHFK440S8860,B0002GTTRC,Hillary K.,Great!  the right one at the right price,Great! the right one at the right,1406246400,"['Appliances', 'Parts &amp; Accessories', 'Refrigerator Parts &amp; Accessories', 'Water Filters']",Water filters,General Electric,Tools &amp; Home Improvement,39.98,0.8,Positive,0.9,1.9,0.44
243,5,,True,"04 4, 2014",ADHCE9CVYBCP2,B0002GTTRC,K.,"We replace our water filter every 6 months. It is easy and not too expensive. And, who doesn't want to get rid of all the 'stuff' in our water!",Easy to install,1396569600,"['Appliances', 'Parts &amp; Accessories', 'Refrigerator Parts &amp; Accessories', 'Water Filters']",Water filters,General Electric,Tools &amp; Home Improvement,39.98,0.6,Positive,0.5,1.7,0.29
244,5,,True,"02 7, 2014",A2KD1R5EFVNAKS,B0002GTTRC,Kay Veress,Its a good filter and the $ok. I have recommended to a few friends whom I know are shopping for filters,good filters,1391731200,"['Appliances', 'Parts &amp; Accessories', 'Refrigerator Parts &amp; Accessories', 'Water Filters']",Water filters,General Electric,Tools &amp; Home Improvement,39.98,0.7,Positive,0.7,1.4,0.46
246,4,,True,"11 11, 2013",A1NNZB448WT9OU,B0002GTTRC,AW596,Was as described and does a good job of filtering water on my GE Profile fridge.  The only complaint that I have is how expensive they are.,Was as described.,1384128000,"['Appliances', 'Parts &amp; Accessories', 'Refrigerator Parts &amp; Accessories', 'Water Filters']",Water filters,General Electric,Tools &amp; Home Improvement,39.98,0.4,Positive,0.4,0.8,0.46
249,5,,True,"07 22, 2013",A1HEBW1WQ4FYAW,B0002GTTRC,Pam,"It is what it is: the filter that my owner's manual tells me to buy.  Frankly, I don't have a clue if it's good or great or what, but it is easy to install and works.  I shopped around, and Amazon had the best price I could find.  Good service, same product, best price, delivery to my door.  That works for me.",Exactly what I needed for the best price around,1374451200,"['Appliances', 'Parts &amp; Accessories', 'Refrigerator Parts &amp; Accessories', 'Water Filters']",Water filters,General Electric,Tools &amp; Home Improvement,39.98,0.3,Positive,0.6,3.2,0.19
250,1,,True,"06 4, 2013",A39MAFAF4Q7KQ2,B0002GTTRC,LadyDi88,Usually buy from lowes and filters last for eight or more months this was installed a month after purchase and only lasted two months. Lesson learned buy from lowes or at least not this seller,Ripped off,1370304000,"['Appliances', 'Parts &amp; Accessories', 'Refrigerator Parts &amp; Accessories', 'Water Filters']",Water filters,General Electric,Tools &amp; Home Improvement,39.98,-0.7,Negative,-0.4,0.9,-0.42
256,1,16,True,"08 18, 2012",A3RBAGMMTP4GJJ,B0002GTTRC,Bob Lauer,This appeared to have been a returned item. Foil covering was off filter end and the standard instruction leaflet was missing from the box. Not very sanitary to install a water filter that apparently was handled by a stranger.,Not brand new,1345248000,"['Appliances', 'Parts &amp; Accessories', 'Refrigerator Parts &amp; Accessories', 'Water Filters']",Water filters,General Electric,Tools &amp; Home Improvement,39.98,-0.7,Negative,-0.7,2.2,-0.31
259,5,,True,"01 5, 2012",A2B5DCTPK9JTZ3,B0002GTTRC,Sara,"It worked perfectly and came quick and on time, installation was pretty easy, I was supposed to exchange it with the other model and I liked the process in Amazon,",Perfect,1325721600,"['Appliances', 'Parts &amp; Accessories', 'Refrigerator Parts &amp; Accessories', 'Water Filters']",Water filters,General Electric,Tools &amp; Home Improvement,39.98,0.6,Positive,0.7,0.7,0.76
267,5,,True,"01 9, 2017",A8FOSBRFYB84L,B0002HMUBI,armando santana,better price than getting the filter only.,Five Stars,1483920000,"['Appliances', 'Parts &amp; Accessories', 'Refrigerator Parts &amp; Accessories', 'Water Filters']",Water filters,GE,Tools &amp; Home Improvement,37.98,0.6,Positive,0.8,0.8,0.76
272,5,,True,"10 8, 2016",AJVVL8ZP31BAB,B0002HMUBI,Mary Tomlin,Exactly what I wanted.,Five Stars,1475884800,"['Appliances', 'Parts &amp; Accessories', 'Refrigerator Parts &amp; Accessories', 'Water Filters']",Water filters,GE,Tools &amp; Home Improvement,37.98,0.8,Positive,0.9,0.9,0.76
281,5,,True,"02 28, 2015",AICXVYKVPJW36,B0002HMUBI,Andrew,shipped fast and arrive well packaged.  Great replacement at low cost.,Great replacement at low cost,1425081600,"['Appliances', 'Parts &amp; Accessories', 'Refrigerator Parts &amp; Accessories', 'Water Filters']",Water filters,GE,Tools &amp; Home Improvement,37.98,0.7,Positive,0.8,1.7,0.44
